,title,department,location,date_added,link
0,"Full-Stack Engineer, Early Career",Software and Services,Austin,"Jun 15, 2021",https://jobs.apple.com/en-us/details/200253987/full-stack-engineer-early-career?team=SFTWR
1,"Backend Engineer, Early Career",Software and Services,Austin,"Jun 29, 2021",https://jobs.apple.com/en-us/details/200253984/backend-engineer-early-career?team=SFTWR
2,iOS Software Engineer - Health,Software and Services,Santa Clara Valley (Cupertino),"Oct 26, 2021",https://jobs.apple.com/en-us/details/200305430/ios-software-engineer-health?team=SFTWR
3,Senior iOS Engineer - Ad Platforms,Software and Services,Austin,"Aug 7, 2021",https://jobs.apple.com/en-us/details/200275090/senior-ios-engineer-ad-platforms?team=SFTWR
4,iOS Engineer - Ad Platforms,Software and Services,Austin,"Aug 6, 2021",https://jobs.apple.com/en-us/details/200257366/ios-engineer-ad-platforms?team=SFTWR
5,CoreOS Power Validation Engineer,Software and Services,San Diego,"Jul 6, 2021",https://jobs.apple.com/en-us/details/200261819/coreos-power-validation-engineer?team=SFTWR
6,CoreOS - System Power Validation Manager,Software and Services,San Diego,"Oct 25, 2021",https://jobs.apple.com/en-us/details/200217529/coreos-system-power-validation-manager?team=SFTWR
7,"Wireless System Engineer, Power Analysis",Software and Services,San Diego,"Sep 27, 2021",https://jobs.apple.com/en-us/details/200276618/wireless-system-engineer-power-analysis?team=SFTWR
8,Sr. Software Engineer - Apple Diagnostics Platform,Software and Services,Austin,"Sep 11, 2021",https://jobs.apple.com/en-us/details/200244502/sr-software-engineer-apple-diagnostics-platform?team=SFTWR
9,Settings and Clock Software Engineer,Software and Services,Santa Clara Valley (Cupertino),"Jul 9, 2021",https://jobs.apple.com/en-us/details/200244805/settings-and-clock-software-engineer?team=SFTWR
10,Senior Experience Prototype Engineer,Software and Services,Raleigh,"Nov 4, 2021",https://jobs.apple.com/en-us/details/200279841/senior-experience-prototype-engineer?team=SFTWR
11,Full Stack Web Engineer - SPG,Software and Services,Santa Clara Valley (Cupertino),"Feb 11, 2021",https://jobs.apple.com/en-us/details/200221626/full-stack-web-engineer-spg?team=SFTWR
12,Full Stack Web Engineer - SPG,Software and Services,Santa Clara Valley (Cupertino),"Jul 21, 2021",https://jobs.apple.com/en-us/details/200269065/full-stack-web-engineer-spg?team=SFTWR
13,WiFi/Bluetooth System Performance Engineer,Software and Services,Santa Clara Valley (Cupertino),"Oct 19, 2021",https://jobs.apple.com/en-us/details/200290898/wifi-bluetooth-system-performance-engineer?team=SFTWR
14,WebKit Test Infrastructure Engineer,Software and Services,Santa Clara Valley (Cupertino),"Nov 5, 2021",https://jobs.apple.com/en-us/details/200308343/webkit-test-infrastructure-engineer?team=SFTWR
15,CoreOS Firmware Validation Engineer,Software and Services,San Diego,"Sep 20, 2021",https://jobs.apple.com/en-us/details/200276135/coreos-firmware-validation-engineer?team=SFTWR
16,"Wireless Systems Engineer, Product Stability",Software and Services,San Diego,"Oct 21, 2021",https://jobs.apple.com/en-us/details/200295112/wireless-systems-engineer-product-stability?team=SFTWR
17,"Wireless Systems Engineer, Product Stability",Software and Services,San Diego,"Nov 1, 2021",https://jobs.apple.com/en-us/details/200295126/wireless-systems-engineer-product-stability?team=SFTWR
18,Database Engineer (Early Career),Software and Services,Austin,"Oct 22, 2021",https://jobs.apple.com/en-us/details/200303605/database-engineer-early-career?team=SFTWR
19,Sr. Tools and Automation Engineer - SPG,Software and Services,Santa Clara Valley (Cupertino),"Feb 11, 2021",https://jobs.apple.com/en-us/details/200221719/sr-tools-and-automation-engineer-spg?team=SFTWR
20,Software Development Engineer in Test - System Charging,Software and Services,Santa Clara Valley (Cupertino),"Oct 26, 2021",https://jobs.apple.com/en-us/details/200295455/software-development-engineer-in-test-system-charging?team=SFTWR
21,CoreOS Firmware Validation Engineer,Software and Services,Beaverton,"Aug 17, 2021",https://jobs.apple.com/en-us/details/200276139/coreos-firmware-validation-engineer?team=SFTWR
22,Wireless Bluetooth Software Engineer,Software and Services,San Diego,"Jul 15, 2021",https://jobs.apple.com/en-us/details/200243775/wireless-bluetooth-software-engineer?team=SFTWR
23,"Web UI Software Engineer, 3D Graphics - SPG",Software and Services,Santa Clara Valley (Cupertino),"Aug 12, 2021",https://jobs.apple.com/en-us/details/200269804/web-ui-software-engineer-3d-graphics-spg?team=SFTWR
24,Software Development Engineer in Test - Platform Power Quality (SOC Power Management),Software and Services,Beaverton,"Nov 10, 2021",https://jobs.apple.com/en-us/details/200273689/software-development-engineer-in-test-platform-power-quality-soc-power-management?team=SFTWR
25,Software Development Engineer in Test - Platform Power Quality (SOC Power Management),Software and Services,San Diego,"Nov 10, 2021",https://jobs.apple.com/en-us/details/200273698/software-development-engineer-in-test-platform-power-quality-soc-power-management?team=SFTWR
26,Sr. iOS Framework Engineer - SPG,Software and Services,Santa Clara Valley (Cupertino),"Feb 11, 2021",https://jobs.apple.com/en-us/details/200221658/sr-ios-framework-engineer-spg?team=SFTWR
27,"Product Manager, Identity Management Services",Software and Services,Santa Clara Valley (Cupertino),"Aug 30, 2021",https://jobs.apple.com/en-us/details/200233442/product-manager-identity-management-services?team=SFTWR
28,Developer Analyst (Early Career),Software and Services,Austin,"May 25, 2021",https://jobs.apple.com/en-us/details/200210820/developer-analyst-early-career?team=SFTWR
29,Software DevOps Engineer (Early Career),Software and Services,Austin,"Oct 20, 2021",https://jobs.apple.com/en-us/details/200301608/software-devops-engineer-early-career?team=SFTWR
30,Security & Compliance Automation Engineer/Developer (Early Career),Software and Services,Austin,"Oct 28, 2021",https://jobs.apple.com/en-us/details/200304759/security-compliance-automation-engineer-developer-early-career?team=SFTWR
31,Software Development Engineer in Test - Energy Technologies,Software and Services,Santa Clara Valley (Cupertino),"Nov 3, 2021",https://jobs.apple.com/en-us/details/200295446/software-development-engineer-in-test-energy-technologies?team=SFTWR
32,"Software Engineer, Home Services",Software and Services,San Diego,"Nov 11, 2021",https://jobs.apple.com/en-us/details/200278888/software-engineer-home-services?team=SFTWR
33,"Software Engineer, Home Services",Software and Services,Raleigh,"Nov 11, 2021",https://jobs.apple.com/en-us/details/200309635/software-engineer-home-services?team=SFTWR
34,Sr. iOS UI Engineer - SPG,Software and Services,Santa Clara Valley (Cupertino),"Aug 12, 2021",https://jobs.apple.com/en-us/details/200275614/sr-ios-ui-engineer-spg?team=SFTWR
35,Evolve Rotational Program - Engineer,Software and Services,New York City,"Nov 11, 2021",https://jobs.apple.com/en-us/details/200294625/evolve-rotational-program-engineer?team=SFTWR
36,Software Engineer (Early Career),Software and Services,Austin,"Nov 10, 2021",https://jobs.apple.com/en-us/details/200310443/software-engineer-early-career?team=SFTWR
37,Senior Software Architect-Home Exploration,Software and Services,Santa Clara Valley (Cupertino),"Aug 25, 2021",https://jobs.apple.com/en-us/details/200280368/senior-software-architect-home-exploration?team=SFTWR
38,Performance Tools Engineer,Software and Services,Santa Clara,"Nov 3, 2021",https://jobs.apple.com/en-us/details/200254322/performance-tools-engineer?team=SFTWR
39,Database Security Engineer (Early Career),Software and Services,Austin,"Oct 26, 2021",https://jobs.apple.com/en-us/details/200297308/database-security-engineer-early-career?team=SFTWR
40,Database Engineer (Early Career),Software and Services,Austin,"Nov 3, 2021",https://jobs.apple.com/en-us/details/200307895/database-engineer-early-career?team=SFTWR
41,Software Engineer (Early Career),Software and Services,Austin,"Oct 22, 2021",https://jobs.apple.com/en-us/details/200301957/software-engineer-early-career?team=SFTWR
42,Software Engineer (Early Career),Software and Services,Austin,"Oct 21, 2021",https://jobs.apple.com/en-us/details/200302338/software-engineer-early-career?team=SFTWR
43,Senior Software Architect-Home Exploration,Software and Services,Santa Clara Valley (Cupertino),"Aug 25, 2021",https://jobs.apple.com/en-us/details/200280368/senior-software-architect-home-exploration?team=SFTWR
44,Performance Tools Engineer,Software and Services,Santa Clara,"Nov 3, 2021",https://jobs.apple.com/en-us/details/200254322/performance-tools-engineer?team=SFTWR
45,"Infra Vendor Systems, Technology Manager",Software and Services,Santa Clara Valley (Cupertino),"Mar 23, 2021",https://jobs.apple.com/en-us/details/200233131/infra-vendor-systems-technology-manager?team=SFTWR
46,Red Team Platform and Hardware Security Researcher,Software and Services,Santa Clara Valley (Cupertino),"Aug 24, 2021",https://jobs.apple.com/en-us/details/200281683/red-team-platform-and-hardware-security-researcher?team=SFTWR
47,Salesforce Developer/Analyst (Early Career),Software and Services,Austin,"Sep 4, 2021",https://jobs.apple.com/en-us/details/200280037/salesforce-developer-analyst-early-career?team=SFTWR
48,Salesforce Developer/Analyst (Early Career),Software and Services,Austin,"Sep 4, 2021",https://jobs.apple.com/en-us/details/200280047/salesforce-developer-analyst-early-career?team=SFTWR
49,Salesforce Developer/Analyst (Early Career),Software and Services,Austin,"Sep 4, 2021",https://jobs.apple.com/en-us/details/200280022/salesforce-developer-analyst-early-career?team=SFTWR
50,Salesforce Developer/Analyst (Early Career),Software and Services,Austin,"Sep 4, 2021",https://jobs.apple.com/en-us/details/200280013/salesforce-developer-analyst-early-career?team=SFTWR
51,Salesforce Developer/Analyst (Early Career),Software and Services,Austin,"Sep 4, 2021",https://jobs.apple.com/en-us/details/200280040/salesforce-developer-analyst-early-career?team=SFTWR
52,Salesforce Developer/Analyst (Early Career),Software and Services,Austin,"Sep 4, 2021",https://jobs.apple.com/en-us/details/200280033/salesforce-developer-analyst-early-career?team=SFTWR
53,Salesforce Developer/Analyst (Early Career),Software and Services,Austin,"Sep 4, 2021",https://jobs.apple.com/en-us/details/200280035/salesforce-developer-analyst-early-career?team=SFTWR
54,Database Engineer - Security (Early Career),Software and Services,Austin,"Oct 20, 2021",https://jobs.apple.com/en-us/details/200301949/database-engineer-security-early-career?team=SFTWR
55,Salesforce Developer/Analyst (Early Career),Software and Services,Austin,"Sep 4, 2021",https://jobs.apple.com/en-us/details/200280053/salesforce-developer-analyst-early-career?team=SFTWR
56,Big Data Software Engineer (Early Career),Software and Services,Austin,"Oct 18, 2021",https://jobs.apple.com/en-us/details/200295463/big-data-software-engineer-early-career?team=SFTWR
57,System Integration Engineer - Platform Architecture,Software and Services,Santa Clara Valley (Cupertino),"Nov 4, 2021",https://jobs.apple.com/en-us/details/200309367/system-integration-engineer-platform-architecture?team=SFTWR
58,Software QA Engineer,Software and Services,Santa Clara Valley (Cupertino),"Nov 8, 2021",https://jobs.apple.com/en-us/details/200292019/software-qa-engineer?team=SFTWR
59,"Senior Product Manager, Special Projects - Ad Platforms",Software and Services,Santa Clara Valley (Cupertino),"Aug 26, 2021",https://jobs.apple.com/en-us/details/200272094/senior-product-manager-special-projects-ad-platforms?team=SFTWR
60,"AI/ML - Machine Learning Engineer, Visual Intelligence",Software and Services,Santa Clara Valley (Cupertino),"Sep 28, 2021",https://jobs.apple.com/en-us/details/200195307/ai-ml-machine-learning-engineer-visual-intelligence?team=SFTWR
61,Software Development Engineer in Test - Energy Technologies,Software and Services,Santa Clara Valley (Cupertino),"Sep 10, 2021",https://jobs.apple.com/en-us/details/200190117/software-development-engineer-in-test-energy-technologies?team=SFTWR
62,"AI/ML - Sr Technical Program Manager, Siri",Software and Services,Santa Clara Valley (Cupertino),"Mar 30, 2021",https://jobs.apple.com/en-us/details/200219592/ai-ml-sr-technical-program-manager-siri?team=SFTWR
63,"AI/ML - Sr Technical Program Manager, Siri",Software and Services,Cambridge,"Jul 29, 2021",https://jobs.apple.com/en-us/details/200271964/ai-ml-sr-technical-program-manager-siri?team=SFTWR
64,macOS Applications Software Engineer,Software and Services,Santa Clara Valley (Cupertino),"Sep 20, 2021",https://jobs.apple.com/en-us/details/200289944/macos-applications-software-engineer?team=SFTWR
65,"Software Engineer, Proactive Intelligence Platform",Software and Services,Santa Clara Valley (Cupertino),"Jul 28, 2021",https://jobs.apple.com/en-us/details/200269044/software-engineer-proactive-intelligence-platform?team=SFTWR
66,"AI/ML - Sr Technical Program Manager, Siri",Software and Services,Seattle,"Jul 1, 2021",https://jobs.apple.com/en-us/details/200221299/ai-ml-sr-technical-program-manager-siri?team=SFTWR
67,Core Audio Software Engineer,Software and Services,Santa Clara Valley (Cupertino),"Jul 23, 2021",https://jobs.apple.com/en-us/details/200254174/core-audio-software-engineer?team=SFTWR
68,"Senior Software Engineer, Search Data Infrastructure - Apple Media Products - Seattle",Software and Services,Seattle,"Aug 8, 2021",https://jobs.apple.com/en-us/details/200268947/senior-software-engineer-search-data-infrastructure-apple-media-products-seattle?team=SFTWR
69,"Senior Software Engineer, Search Data Engineer - Apple Media Products - Seattle",Software and Services,Seattle,"Sep 20, 2021",https://jobs.apple.com/en-us/details/200285285/senior-software-engineer-search-data-engineer-apple-media-products-seattle?team=SFTWR
70,"Full-Stack Engineer, Apple Original Content",Software and Services,Culver City,"Oct 26, 2021",https://jobs.apple.com/en-us/details/200282705/full-stack-engineer-apple-original-content?team=SFTWR
71,"Full-Stack Engineer, Apple TV Original Content",Software and Services,Culver City,"Oct 26, 2021",https://jobs.apple.com/en-us/details/200280565/full-stack-engineer-apple-tv-original-content?team=SFTWR
72,"Software Engineer, Proactive Intelligence Platform",Software and Services,Santa Clara Valley (Cupertino),"Nov 1, 2021",https://jobs.apple.com/en-us/details/200301894/software-engineer-proactive-intelligence-platform?team=SFTWR
73,"Software Engineer, Platforms & Infrastructures, Proactive",Software and Services,Santa Clara Valley (Cupertino),"Oct 5, 2021",https://jobs.apple.com/en-us/details/200232354/software-engineer-platforms-infrastructures-proactive?team=SFTWR
74,MSI Full Stack Software Engineer- AI/ML & Big Data,Software and Services,Santa Clara Valley (Cupertino),"Aug 26, 2021",https://jobs.apple.com/en-us/details/200281805/msi-full-stack-software-engineer-ai-ml-big-data?team=SFTWR
75,MSI Full Stack Software Engineer- AI/ML & Big Data,Software and Services,Santa Clara Valley (Cupertino),"Aug 24, 2021",https://jobs.apple.com/en-us/details/200250395/msi-full-stack-software-engineer-ai-ml-big-data?team=SFTWR
76,"Senior Software Engineer, Apple Classroom",Software and Services,Santa Clara Valley (Cupertino),"Jul 28, 2021",https://jobs.apple.com/en-us/details/200269178/senior-software-engineer-apple-classroom?team=SFTWR
